,ID,IdSubject,PersonNumber,Text,MeetingCouncilAbbreviation,MeetingDate,IdSession,SpeakerFunction,CouncilId,Start,End,Function,LanguageOfText
399,185118,34636,4094,"Frau Kollegin Allemann, ich hätte eine Frage. Sie und diverse Vorrednerinnen und Vorredner haben die tragischen Vorfälle zu Hause angesprochen, sei es ein spontanes Gewaltdelikt, häusliche Gewalt oder allenfalls auch Suizid. Meine Frage, die mir noch niemand hat beantworten können: Warum geht man davon aus, dass mit registrierten Waffen keine spontanen Gewaltdelikte zu Hause oder keine Suizide mehr begangen werden könnten? Ich höre immer, dass wir das mit der Nachregistrierung verhindern wollen. 
",N,20150505,4918,Mit-M,1.0,2015-05-05T08:56:55,2015-05-05T08:57:37,Mit-M,DE
400,185119,34636,1131,"Das hat heute niemand gesagt, ich habe sehr aufmerksam zugehört. Es wäre eine Illusion, in Bezug auf den Missbrauch von Schusswaffen eine hundertprozentige Sicherheit hinkriegen zu können. Was die Suizide anbelangt, ist die Verfügbarkeit von Schusswaffen das entscheidende Element und nicht die Registrierung. Von der Illusion, die Sie nun aufgebaut haben, ist aber auch niemand ausgegangen. Es geht hier vor allem darum, Missbräuche und tragische Ereignisse zu verhindern, bei welchen es um kriminelle Taten geht und nicht um Suizide. Diesbezüglich machen wir mit dieser Verlinkung der Datenbanken einen relevanten Schritt.
",N,20150505,4918,Mit-F,1.0,2015-05-05T08:57:37,2015-05-05T08:58:14,Mit-F,DE
401,185120,34636,1135,"Frau Kollegin, mit wie vielen Opfern weniger rechnen Sie bei der häuslichen Gewalt, wenn die Waffen registriert sind - in etwa?  
",N,20150505,4918,Mit-M,1.0,2015-05-05T08:58:14,2015-05-05T08:58:31,Mit-M,DE
402,185121,34636,1131,"Wir hoffen, dass die Anzahl abnimmt. Ich werde das nicht mit einer konkreten Zahl beziffern. Ich habe es mehrfach betont: Es geht darum, dass wir neu eine unbürokratische Online-Abfrage durchführen können. Es ist ein Wunsch von unten, von den Polizeikommandantinnen und -kommandanten, von den Polizisten, die tagtäglich an der Front arbeiten. Sie sagen uns - in der Kommission und auch ausserhalb des Bundeshauses -, dass es für sie ein wichtiges Instrument für die tagtägliche Arbeit sei, von dem sie sich viel erhoffen würden. Im Bereich der häuslichen Gewalt sind andere Massnahmen ebenso wichtig. Herr Amstutz, Sie wissen genauso gut wie ich, dass wir immer einen Strauss, einen Mix an Massnahmen haben müssen und dass nicht eine einzige Massnahme zu einer bestimmten Anzahl weniger Toten führt.
",N,20150505,4918,Mit-F,1.0,2015-05-05T08:58:31,2015-05-05T08:59:17,Mit-F,DE
403,185122,34636,1147,"Geschätzte Kollegin, als Gemeindepräsidentin und zivile Polizeivorsteherin hatte ich die Gelegenheit und die Pflicht, zusammen mit uniformierten Kantonspolizisten in Fällen häuslicher Gewalt in Privathäuser und -wohnungen zu gehen. Wir wussten nicht, ob und wie viele Waffen sich dort befanden. Streben Sie eben nicht genau an, dass in solchen Fällen die Registrierung vorliegt? Können Sie dazu noch Ausführungen machen?
",N,20150505,4918,Mit-F,1.0,2015-05-05T08:59:17,2015-05-05T08:59:59,Mit-F,DE
404,185123,34636,1131,"Ich habe es vorhin in meinem Votum schon einmal gesagt: Genau dieser Grund, den Sie jetzt erwähnt haben, war für die Polizistinnen und Polizisten, die auf uns zugekommen sind, ausschlaggebend, um diese Anliegen einzubringen und voranzutreiben. Vielen Dank für die Unterstützung.
",N,20150505,4918,Mit-F,1.0,2015-05-05T08:59:59,2015-05-05T09:00:18,Mit-F,DE
405,185124,34636,4074,"Le sujet des armes anime le débat politique suisse depuis plusieurs années. Après le refus du peuple suisse de conserver les armes dans des arsenaux, la question des drames en rapport avec l'utilisation d'armes à feu reste d'une cruelle actualité. Plusieurs événements tragiques anciens, d'autres plus récents, sont encore dans toutes les mémoires: suicides, homicides, drames familiaux, la liste est longue. Et la résolution de ce type de problèmes est difficile.
Aujourd'hui, avec l'amélioration de l'échange d'informations entre les autorités au sujet des armes, un grand pas dans la bonne direction peut être réalisé; il ne s'agit toutefois que d'un pas, car la solution miracle n'existe pas. Cependant, créer les conditions favorables permettant de réduire certains risques paraît déjà à ce stade essentiel. Et l'ensemble des membres de la commission partage cette appréciation. L'essentiel des dispositions proposées dans la présente loi, et notamment l'amélioration de l'échange d'informations entre les autorités au sujet des armes, sera largement soutenu.
Chacun a bien compris qu'il s'agit d'une question de sécurité, de protection, en tout premier lieu pour les autorités et les forces de sécurité qui sont amenées, lors de situations de crise, à intervenir dans des ménages, où elles sont confrontées à des personnes désespérées, en proie à des pulsions d'agressivité, en rapport avec les drames usuels de la vie. Ce sont autant de moments où tout est possible, où tout peut basculer, où un rien peut mettre le feu aux poudres. Si un intervenant extérieur tente de s'immiscer dans une telle situation conflictuelle, tout peut dégénérer. Acculé, sans issue, un quidam peut devenir un forcené prêt à tout, d'autant plus que l'alcool s'invite souvent dans l'histoire. Dès lors, en présence d'une arme, les conséquences peuvent se révéler dramatiques.
Je suis très sensibilisé à ce type de situation, car voilà quelques années, alors que j'intervenais comme médecin à domicile chez un patient sous l'emprise de l'alcool, désespéré par un divorce, j'ai passé une bonne heure avec lui pour le calmer, avec une arme chargée pointée contre moi. Il s'agissait d'un vieux pistolet, enregistré nulle part.
Dans la mesure du possible, il est impératif que les agents de la force publique sachent, lors de chaque intervention, où ils mettent les pieds, si des armes sont présentes dans la maison. Pour ce faire, la police doit disposer d'informations facilement et immédiatement accessibles. Le cas échéant, les agents d'intervention pourront s'entourer des mesures de sécurité accessoires adéquates, mesures maximales utilisées d'habitude pour appréhender un délinquant avéré et recherché.
Le risque existera toujours, mais, avertis, les agents pourront mieux se prémunir pour se protéger ainsi que pour protéger d'autres protagonistes, par exemple la famille du forcené.
Cette loi propose l'amélioration de la transmission des informations entre les fichiers cantonaux et règle leur accès facilité sans délai. L'utilisation du numéro AVS sera également un plus pour s'assurer de l'identification correcte des personnes. Les autorités militaires pourront avoir accès à des données judiciaires pour refuser une arme ou la retirer au cas où sa possession pourrait être considérée comme dangereuse. Ainsi la possession de l'arme personnelle militaire sera subordonnée à l'absence de données permettant de craindre une possible utilisation abusive de l'arme. Encore une mesure qui n'est jamais efficace à cent pour cent, car les circonstances et les aléas de la vie peuvent parfois pousser certains à des gestes extrêmes.
Les seules divergences, aux articles 34 et 42b, concernent la question de l'obligation rétroactive de déclarer son arme et le délai accordé pour le faire, et subsidiairement, la question d'une amende en cas de non-respect de l'obligation. Sans obligation légale, la volonté du législateur d'obtenir une photographie la plus précise possible des armes détenues dans le pays tournerait à la farce. Sans la menace d'une sanction, quel serait le poids d'une telle obligation?
A travers cette loi, il n'est aucunement question de stigmatiser quiconque. Les chasseurs, les tireurs sportifs, les collectionneurs pourront continuer à s'adonner à leur passion préférée sans contrainte. Encore une fois, le but recherché est simple: disposer de fichiers représentatifs, à jour, facilement accessibles, permettant à un représentant de l'autorité de s'assurer de la présence ou non d'armes à feu chez un quidam, chez qui une intervention de la force publique est nécessaire. Réduire au maximum les risques, tel est le but de la loi.
Le groupe socialiste entrera en matière et soutiendra la proposition de la majorité à l'article 34 et la proposition de la minorité I (Graf-Litscher) à l'article 42b.
",N,20150505,4918,Mit-M,1.0,2015-05-05T09:00:18,2015-05-05T09:05:17,Mit-M,FR
406,185125,34636,4137,"Monsieur Fridez, lorsqu'il s'agit d'un forcené retranché dans un appartement, qui a proféré des menaces, pensez-vous un seul instant que le fait de savoir que ce dernier n'est pas fiché comme détenteur d'une arme modifiera l'intervention de la police?
",N,20150505,4918,Mit-M,1.0,2015-05-05T09:05:17,2015-05-05T09:05:44,Mit-M,FR
407,185126,34636,4074,"J'ai été maire pendant de nombreuses années. Ce que je peux dire en tout cas, Monsieur Golay, c'est que lorsque nous intervenions dans des appartements, nous avions l'impression de pouvoir raisonner les personnes, mais se trouver tout à coup en face de quelqu'un d'armé est véritablement très inquiétant. Il y a toujours des situations particulières. Il faut les éviter au maximum. Ma commune étant petite, je connaissais les personnes chez qui j'intervenais comme maire, autorité de la force publique. Dans les grandes villes, cela n'est pas forcément le cas. C'est effectivement un élément supplémentaire à prendre en compte. On ne va pas intervenir dans chaque situation avec tous les moyens à disposition. Pouvoir mieux évaluer l'effectif à engager dans une situation est certainement un plus intéressant. Le but est d'éviter au maximum que de petits événements se terminent en tragédies effroyables.
",N,20150505,4918,Mit-M,1.0,2015-05-05T09:05:44,2015-05-05T09:06:49,Mit-M,FR
408,185127,34636,4135,"Monsieur Fridez, je vous ai bien écouté. Ne pensez-vous pas que la réglementation risque d'être contre-productive et créer encore plus de danger pour le policier qui doit intervenir? Le policier qui regardera sur le fichier et verra que le suspect n'est en possession d'aucune arme ne prendra pas les précautions nécessaires qui sont prises à l'heure actuelle. Aujourd'hui, on ne sait  effectivement pas à quel risque on s'expose. Selon vos arguments, tout le monde est honnête et gentil et inscrira son arme dans le registre. Ainsi, en cas d'intervention, on regardera le registre, et s'il n'y a pas d'armes, on pourra intervenir sans autre. Ne pensez-vous pas que le risque de ne pas prendre les précautions nécessaires est réel?
",N,20150505,4918,Mit-M,1.0,2015-05-05T09:06:49,2015-05-05T09:07:31,Mit-M,FR
409,185128,34636,4074,"Je vous remercie pour votre question, Monsieur Clottu. Il est évident qu'un policier qui doit intervenir quelque part est toujours armé et connaît les règles minimales de sécurité à respecter.
La question dont on parle maintenant, c'est surtout de savoir si les armes qui ne sont pas déclarées doivent l'être ou non. Je crois qu'il faut une clarté maximale; avec cette déclaration obligatoire, on aura une meilleure géographie de la situation des armes dans notre pays et on pourra aider les forces de l'ordre au maximum, aider les autorités à intervenir avec les moyens adéquats.
Je crois que votre remarque n'est pas tout à fait juste. De toute façon, il y a des mesures minimales de sécurité à respecter. Simplement, face à certaines situations, des mesures un peu plus importantes doivent parfois être adoptées.
",N,20150505,4918,Mit-M,1.0,2015-05-05T09:07:31,2015-05-05T09:08:20,Mit-M,FR
410,185129,34636,28,"Man hat im Zusammenhang mit Fehlverhalten von Angehörigen der Armee und dem Entzug der Armeewaffe festgestellt, dass die Information der Zuständigen in der Armee nicht funktioniert. Das zu korrigieren ist eigentlich der Kerngehalt dieser Vorlage. Wenn die Polizei, aus welchen Sicherheitsgründen auch immer, einem Armeewaffenträger die Waffe abgenommen und entzogen hat, erfährt die Armee von diesem Vorgang aufgrund der heutigen Rechtslage nichts. Das ist an sich unverständlich und muss korrigiert werden. Das ist das Wesentliche dieser Vorlage. Es geht nicht an, dass in diesem Zusammenhang juristische Gründe oftmals wichtiger sind als vernünftige Abläufe. Gegen eine Gesetzesänderung, die diesem Umstand Rechnung trägt, ist an sich nichts einzuwenden, auch von unserer Seite nicht. Wir verzichteten darum auch auf den Nichteintretensantrag, es wurde bereits gesagt.
Nun beantragt der Bundesrat aber - die Kommissionsmehrheit ist ihm, für uns etwas überraschend, gefolgt - die Registrierung der Waffen von Personen, welche diese nach dem Austritt aus der Armee zu Eigentum übernommen haben. Dazu soll eine Nachregistrierungspflicht unter Strafandrohung in die Vorlage aufgenommen werden. Das heisst, wenn ehemalige Armeeangehörige, die ihre persönliche Waffe mit nach Hause genommen haben, nicht innert einer gewissen Zeit die Registrierung vornehmen lassen, machen sie sich strafbar. Es sind einige Zehntausend, vielleicht hunderttausend Männer, die ihre Waffe aus der Zeit in der Armee zu Hause haben. Wir sind der Meinung, dass das eine drohende Kriminalisierung von ehemaligen Dienstpflichtigen ist - so geht es nicht! Das ist unanständiges Misstrauen des Staates gegenüber dem Bürger.
Zum immer wieder erwähnten Argument eines Sicherheitsgewinns durch diese Vorlage kann ich mich eigentlich kurzfassen, weil Kollege Müller in ausgezeichneter Form dargelegt hat, dass das eine Illusion ist. Ich bin auch der Meinung: Wenn die Polizei zu einem Einsatz ausrücken muss, dann muss sie doch je nach Herausforderung unabhängig von einem Waffenregister davon ausgehen, dass eine Waffe im Spiel sein kann. Ein Polizist kann sich doch nicht auf ein Waffenregister verlassen, denn gerade die Schlimmsten lassen wahrscheinlich ihre Waffe kaum registrieren. Was in dieser Vorlage noch dazukommt, ist die Tatsache, dass diese Revision die Nachregistrierung aufnimmt, obwohl das zwei Jahre zuvor in einer Volksinitiative ein Hauptstreitpunkt war und 57 Prozent der Stimmenden diese Initiative abgelehnt haben.
Wir beantragen Ihnen, in Artikel 32j Absatz 2 Buchstabe a konsequenterweise auch Neuentlassene, sofern sie die persönliche Waffe zu Eigentum übernehmen, gleich zu behandeln wie ehemalige Armeeangehörige und sie nicht in das Register aufzunehmen. Wir wehren uns nicht gegen eine vernünftige Behördeninformation, gegen einen Austausch, der Sinn macht. Aber unsere Zustimmung zu dieser Vorlage machen wir abhängig von der Abstimmung zum Minderheitsantrag Büchler Jakob. Wenn dieser Minderheitsantrag abgelehnt wird, werden wir die Vorlage ablehnen.
",N,20150505,4918,Mit-M,1.0,2015-05-05T09:08:20,2015-05-05T09:13:02,Mit-M,DE
411,185130,34636,4059,"Die Grünliberalen stehen selbstverständlich zu dieser Vorlage.
Worum geht es? Zum einen geht es vor allem, wie das Toni Bortoluzzi so schön gesagt hat, um den Informationsaustausch zwischen militärischen und polizeilichen Behörden, der heute aus eigentlich unverständlichen Gründen noch nicht funktioniert. Es geht aber zum andern auch darum, und das ist meines Erachtens ebenso wichtig, dass Personen, von denen man weiss, dass sie andere oder sich selbst mit der Waffe gefährden könnten, und deren Waffenbesitz von den Behörden gegenseitig gemeldet werden. Dazu ist die Verknüpfung der Waffenregister zwischen den Kantonen unbedingt notwendig. Das sind meiner Meinung nach die zwei wichtigsten Verbesserungen in diesem Gesetz.
Die Nachmeldung von Handfeuerwaffen, die sich bereits in Privatbesitz befinden, ist eine ziemlich unproblematische Geschichte. Wie Sie sich erinnern können, gilt seit 2008 grundsätzlich die Registrierungspflicht beim Neuerwerb von Waffen. Nun müssen wir irgendwann anfangen, die altrechtlichen Waffen ebenfalls ins Recht zu setzen. Wir machen das mit einer sehr langen Übergangsfrist von vier Jahren. Zudem sehen wir, was die Busse bei der vorsätzlichen Verletzung der Meldepflicht anbelangt - nur dann gibt es eine Busse -, sehr, sehr milde Mittel vor. Wir müssen uns im Klaren darüber sein, dass das Gewehr, das im Schrank einer Witwe steht, die schon lange vergessen hat, dass das Gewehr noch dort ist, wahrscheinlich wirklich keine Gefahr darstellt. Es ist tatsächlich nicht so wichtig, ob eine solche Waffe jetzt gemeldet wird. Doch irgendwann wird diese Witwe sterben, wobei die Waffe dann nicht an den Sohn, sondern, wie das heute häufig der Fall ist, direkt an den Enkel übergeht. Der Enkel hat aber unter Umständen, aus welchen Gründen auch immer, keinen einzigen Tag Militärdienst geleistet und hat dann plötzlich eine automatische Waffe zu Hause.
Ich bin der Meinung, dass wir irgendwann einmal damit anfangen müssen, diese Waffen zu registrieren. Es geht auch nicht darum, dass zwei Millionen Waffenbesitzer irgendwie kriminalisiert werden sollen, auf keinen Fall. Ich stehe hier auch dazu, dass ich selber gerne schiesse; ich bin zudem nicht ein übler Schütze, auch mit Kurzwaffen. Aber es macht mir doch überhaupt nichts aus, dass meine Waffen registriert sind. Da fällt mir doch kein Stein aus der Krone.
Ich bitte Sie darum im Namen der GLP-Fraktion, hier überall der Kommissionsmehrheit zu folgen. Eine Übergangsfrist von vier Jahren ist sinnvoll, und es ist auch eine sehr sanfte Sanktion, dass eine Busse nur bei vorsätzlicher Verletzung der Meldepflicht verhängt wird. Damit wird ein langsamer Wechsel von einem vollkommen unklaren und intransparenten Waffenbesitz in der Schweiz hin zu einer besseren Information darüber, wo die Waffen sind und wo es allenfalls Gefährdungspotenzial geben könnte, ermöglicht.
",N,20150505,4918,Mit-M,1.0,2015-05-05T09:13:02,2015-05-05T09:16:28,Mit-M,DE
