,ID,IdSubject,PersonNumber,Text,MeetingCouncilAbbreviation,MeetingDate,IdSession,SpeakerFunction,CouncilId,Start,End,Function,LanguageOfText
257,181808,33342,4052,"Am 17. Dezember 2010 reichte Nationalrat Jacques Bourgeois die parlamentarische Initiative 10.538, ""Bundesgesetz über die technischen Handelshemmnisse. Lebensmittel vom Cassis-de-Dijon-Prinzip ausnehmen"", ein. Die parlamentarische Initiative wurde von nicht weniger als 86 Nationalrätinnen und Nationalräten mitunterzeichnet. Die Kommission für Wirtschaft und Abgaben des Nationalrates beschloss am 8. November 2011, der Initiative Folge zu geben. Die ständerätliche Schwesterkommission stimmte diesem Beschluss am 20. Januar 2012 zu.
In der Folge wurden vonseiten der Kommission für Wirtschaft und Abgaben Ihres Rates umfangreiche Berichte vom Seco zu den Auswirkungen des Cassis-de-Dijon-Prinzips bei Lebensmitteln verlangt. Ein entsprechender erster Bericht mit 93 Seiten wurde am 4. April 2013 zuhanden der Kommission abgegeben. Die Bilanz zum Cassis-de-Dijon-Prinzip bei Lebensmitteln fiel in diesem Bericht sehr ernüchternd aus. Wie auf Seite 52 des Berichtes nachgelesen werden kann, wurden durch das Seco Fragebogen an 1000 Firmen versandt. Auswertbare Antworten kamen 27 zurück. Nur 2 Firmen gaben an, neue Produkte unter Nutzung des Cassis-de-Dijon-Prinzips in ihr Sortiment aufgenommen zu haben. Auf die Frage, warum das Cassis-de-Dijon-Prinzip nicht genutzt werde, antworteten 14 Firmen. Davon hatten 6 keine Absicht, Produkte parallel zu importieren; 2 Unternehmen machten die fehlende Akzeptanz des Prinzips geltend; 3 äusserten die Gefahr eines Reputationsrisikos, die mit der Nutzung des Cassis-de-Dijon-Prinzips verbunden sei; für 2 war es zu komplex, das Prinzip zu nutzen; und eine Firma gab an, sich überhaupt zu wenig mit technischen Vorschriften auszukennen.
Als das Cassis-de-Dijon-Prinzip für Lebensmittel in der Schweiz - notabene ohne Reziprozität - eingeführt wurde, ging man von einem Kostensenkungspotenzial für die Konsumenten von 2 Milliarden Franken aus. Dies ist nicht einmal ansatzweise eingetreten. Beim Bundesamt für Gesundheit sind 6 Personen mit der Administration des Cassis-de-Dijon-Prinzips für Lebensmittel beschäftigt. Ihre Kommission ist der Überzeugung, dass diese Ressourcen an einem anderen Ort effizienter eingesetzt werden können.
Aufgrund der Berichte und bisherigen Erkenntnisse lehnte es die Kommission für Wirtschaft und Abgaben mit 14 zu 11 Stimmen ab, die parlamentarische Initiative abzuschreiben. Sie beantragte Ihnen eine Fristverlängerung. Diesem Antrag stimmte der Nationalrat am 21. März 2014 mit 134 zu 48 Stimmen bei 8 Enthaltungen deutlich zu. Am 20. Mai 2014 prüfte die WAK-NR den Vorentwurf und nahm diesen in der Gesamtabstimmung mit 15 zu 10 Stimmen an. Sie beschloss zudem die Eröffnung einer Vernehmlassung.
In der Vernehmlassung gab es Kreise, welche die von der parlamentarischen Initiative angeregte Gesetzesänderung ablehnten und vor allem monierten, man müsse diesem System mehr Zeit geben, um auch eine messbare Wirkung zu erzielen. Auf der anderen Seite war eine starke Allianz für eine Zustimmung zur Gesetzesänderung, die von zwei Dritteln der Kantone ebenfalls unterstützt wurde.
Diese Kantone machen geltend, dass das Cassis-de-Dijon-Prinzip zu einer Verwässerung der hohen schweizerischen Qualitäts- und Produktionsstandards führe. Weiter würde die Schweizer Qualitätsstrategie untergraben, Intransparenz gefördert und die Schweizer Konsumentinnen und Konsumenten würden in die Irre geführt. Dies geschehe, weil unter dem Cassis-de-Dijon-Prinzip Produkte mit der Herkunftsbezeichnung ""Schweiz"" in der Schweiz nach ausländischen Vorschriften hergestellt und auf den Markt gebracht werden könnten, ohne dass die Konsumentin oder der Konsument in der Lage wäre, dies zu erkennen. Über diese Bestimmung zur Nichtdiskriminierung von inländischen Produzenten würden tiefere Produktionsvorschriften ""importiert"", denn bei rund der Hälfte der unter dem Cassis-de-Dijon-Prinzip bewilligten Lebensmittel würden wertgebende Inhaltsstoffe durch billigere Stoffe ersetzt oder sie würden höhere Anteile an Fremdstoffen wie Pestizide, Aflatoxine, Taurine usw. aufweisen. Das führe dazu, dass die Schweizer Lebensmittelgesetzgebung nicht angewandt werde, was die Positionierung von Produkten erschwere, die nach Schweizer Recht hergestellt würden. Das Vertrauen in den hohen Qualitätsstandard von Schweizer Produkten würde dadurch geschwächt, zum  Schaden der Schweizer Produzenten und Hersteller. Weiter wird von der grossen Mehrheit der Kantone, die die Vorlage annehmen, moniert, dass die bestehende Regelung den administrativen Aufwand sowohl beim Bund als auch bei den Kantonen erhöht hat.
Kritisiert wird weiter, dass die Kontrolle der nach dem Cassis-de-Dijon-Prinzip zugelassenen Lebensmittel den Kantonen obliege, was zur Folge habe, dass die Kontrollbehörden nicht nur die Schweizer, sondern auch die ausländischen Rechtsnormen kennen müssten. Dies sei schwierig und führe zu zusätzlichem Aufwand bei den Kantonen. Das Bewilligungsverfahren beim Bundesamt für Lebensmittelsicherheit und Veterinärwesen habe hohe Kosten zur Folge und werde aufgrund seiner Komplexität ohnehin nur verhalten in Anspruch genommen. Die Kosten, welche aufgrund des Cassis-de-Dijon-Prinzips anfielen, rechtfertigten sich angesichts des ausbleibenden Nutzens nicht.
Nach Sichtung und Diskussion der Vernehmlassungsantworten entschied die WAK-NR mit 15 zu 10 Stimmen, Ihnen die Gesetzesvorlage zur Annahme zu empfehlen. Nochmals die Hauptgründe für diesen Entscheid: Gemäss den Erfahrungen in der Praxis, den vorliegenden Berichten des Bundesrates und der durchgeführten Vernehmlassung hat das Cassis-de-Dijon-Prinzip bei Lebensmitteln praktisch keine Wirkung erzielt. Weder Verarbeitung noch Handel, noch Konsumenten, noch Produzenten haben einen Nutzen davon. Die Administration ist zudem teuer.
Die Mehrheit der WAK Ihres Rates bittet Sie, der vorliegenden Gesetzesrevision in Umsetzung der parlamentarischen Initiative Bourgeois 10.538, ""Bundesgesetz über die technischen Handelshemmnisse. Lebensmittel vom Cassis-de-Dijon-Prinzip ausnehmen"", zuzustimmen und damit den Antrag der Minderheit abzulehnen.
Ich sage nun gleich auch noch etwas zur Standesinitiative Bern. Aufgrund der Erfüllung der parlamentarischen Initiative 10.538 hat Ihre WAK entschieden, mit der Standesinitiative Bern 11.321, ""Cassis-de-Dijon-Prinzip"", keinen weiteren Gesetzgebungsprozess einzuleiten. Deshalb wurde dieser Standesinitiative ohne Gegenantrag keine Folge gegeben. Ihre Kommission bittet Sie, auch diesen Antrag zu unterstützen.
",N,20150506,4918,Mit-M,1.0,2015-05-06T10:49:13,2015-05-06T10:57:12,*,DE
258,181809,33342,1119,"L'initiative parlementaire Bourgeois, déposée en décembre 2010, a fait l'objet d'intenses discussions au sein de la commission. Après la décision de notre commission de donner suite à cette initiative le 8 novembre 2011 et celle, identique, prise par la commission soeur du Conseil des Etats le 20 janvier 2012, nous avons, au stade du projet d'acte, débattu des possibilités de modifier la législation dans le sens demandé par l'auteur de l'initiative.
Un rapport a également été demandé au SECO afin de connaître l'impact du principe du ""Cassis de Dijon"" pour les denrées alimentaires depuis sa mise en oeuvre en juin 2010.
Nous vous soumettons aujourd'hui un projet de modification de la loi sur les entraves techniques au commerce excluant les denrées alimentaires de ce principe.
Qu'est-ce qui a poussé la majorité de la commission à vous faire cette proposition? Ce sont principalement les éléments suivants.
D'abord, l'application unilatérale du principe du ""Cassis de Dijon"" équivaut à importer des normes et non des produits. En effet, afin que les fabricants suisses ne soient pas discriminés par rapport à leurs homologues européens, ils peuvent demander l'autorisation, sur la base du principe du ""Cassis de Dijon"", que le produit en question soit admis chez nous et qu'ils puissent le produire selon les mêmes prescriptions que celles qui prévalent dans le pays d'où la marchandise est issue. Par conséquent, on vide le droit suisse de son sens et de son utilité. Dans notre Etat de droit, la procédure correcte consisterait à modifier le cas échéant notre législation en l'adaptant aux normes européennes.
Ensuite, cette façon de procéder remet en question notre politique et notre stratégie de qualité dans le domaine des denrées alimentaires. Nous savons que nos exploitations agricoles, confrontées à un environnement économique où les coûts de production sont plus élevés par comparaison avec l'Union européenne, ne peuvent, pour tirer leur épingle du jeu, que miser sur la qualité et la haute valeur ajoutée des produits. Ceci passe par une différenciation de notre législation par rapport à celle de l'Union européenne. Or, force est de constater que l'application unilatérale du principe du ""Cassis de Dijon"", en important des normes nivelant la qualité par le bas, vient torpiller cette stratégie de qualité et la plus-value que nous voulons mettre dans nos produits.
En outre, la déclaration des produits est également lacunaire et induit le consommateur en erreur. Selon l'article 16e alinéa 3 de la loi sur les entraves techniques au commerce, ""l'information sur le produit et sa présentation ne doivent pas donner l'impression que le produit satisfait aux prescriptions techniques suisses"". Or nous constatons que des produits sont commercialisés sous la même dénomination, par exemple du cidre, et il faut lire l'étiquette pour en connaître l'origine et la composition, origine qui n'est pas toujours garantie, compte tenu du fait que l'Union européenne n'indique pas toujours le pays de production. En effet, lorsque le pays de production ne peut être décelé, c'est la région, voire la Communauté européenne qui peut être déclarée comme pays de production. Dans ces cas, cela équivaut à ne rien déclarer.
De plus, un autre problème réside dans les contrôles et la souveraineté de notre pays. Il appartient au requérant, selon la législation de notre pays, de prouver que la denrée alimentaire satisfait aux prescriptions techniques autorisées. C'est ensuite aux chimistes cantonaux de vérifier la véracité des informations fournies, autorités d'exécution qui doivent déjà veiller à l'application en bonne et due forme d'une trentaine d'ordonnances dans le domaine alimentaire. A cela s'ajoute la nécessité de contrôler des normes de pays étrangers par le biais de l'appréciation du terme ""denrées similaires"" à laquelle la décision s'applique, un terme des plus flous, qui laisse la place à une appréciation à géométrie variable, sans compter la bureaucratie supplémentaire que cela exige - qu'il faudrait plutôt réduire qu'augmenter. On peut également se demander s'il appartient aux cantons de veiller à l'application d'un droit d'autres Etats, alors que ces derniers sont tenus de mettre en oeuvre le droit fédéral, conformément à la Constitution et à la loi. D'autant plus que la Suisse n'étant pas membre de l'Union européenne, elle n'est soumise à aucune disposition du droit international qui la contraindrait à reconnaître des dispositions légales d'autres pays. L'application unilatérale du principe du ""Cassis de Dijon"" est ainsi une perte de souveraineté supérieure. C'est pourquoi, lors de la consultation, deux tiers des cantons ont appuyé nos décisions.
Enfin, seuls sont habilités à recourir les requérants qui déposent une demande. Toute autre personne ou organisation, si elle se sent discriminée, n'a aucun moyen de recourir contre une telle décision. Est-ce cela notre démocratie? Est-ce cela que nous avons voulu? Je ne le crois pas.
Le rapport du SECO qui nous a été remis sur le sujet atteste également que l'impact sur les prix, les 2 milliards de francs prévus en faveur des consommateurs, n'est qu'un miroir aux alouettes. Pourquoi alors maintenir six postes de travail dans ce domaine alors que nous pourrions les économiser?
Par 15 voix contre 10, la Commission de l'économie et des redevances vous recommande, pour les raisons évoquées, de soutenir ces modifications législatives et de rejeter la proposition de la minorité.
Permettez-moi d'ajouter une phrase au sujet de l'initiative 11.321 du canton de Berne. La commission vous suggère, à l'unanimité, de ne pas y donner suite.
",N,20150506,4918,Mit-M,1.0,2015-05-06T10:57:12,2015-05-06T11:03:54,*,FR
259,181810,33342,1117,"La minorité de la commission, que je représente, s'oppose à l'entrée en matière sur cette révision de loi, considérant qu'il n'est pas juste de revenir à l'ancien système.
Le principe du ""Cassis de Dijon"" permet d'éliminer les entraves techniques au commerce entre la Suisse et l'Union  européenne. Ce principe a été introduit en juin 2010 et l'expérience faite depuis lors nous a apporté quelques indications.
Le principe ne péjore pas notre production agricole, car il ne concerne pas la qualité des produits frais ou des matières premières, mais uniquement la définition des recettes et leur reconnaissance. Le sirop est un exemple souvent cité: qu'il soit composé de 15 ou 35 pour cent de fruits, il n'y a pratiquement pas de fruits suisses dans la composition de ce produit et nous ne sommes donc pas touchés en ce qui concerne le produit indigène. Je dirai même qu'il y a plus de chances de trouver un produit d'origine suisse dans le sucre qui compose le sirop que dans la teneur en fruits.
C'est la qualité de la matière première utilisée qui fait la qualité d'un produit. Or le principe du ""Cassis de Dijon"" ne concerne pas la matière première, mais uniquement la reconnaissance d'une formule de fabrication. La déclaration de l'origine a été exigée lors de l'introduction de cette législation et la qualité des denrées est toujours soumise à un examen particulier par l'Office fédéral de la santé publique avant la mise sur le marché de celles-ci. En outre, les déclarations sont obligatoires sur l'emballage.
Le principe du ""Cassis de Dijon"" ne touche pas à la stratégie qualité de notre agriculture. Celle-ci doit réussir, sans exclusion de concurrence et avec l'approbation des consommateurs, à proposer un produit de qualité, d'origine et de proximité. L'introduction de la législation ""Swissness"" que nous avons votée permettra de profiler les produits suisses et d'apporter encore plus de transparence sur l'origine de leur composition.
Les consommateurs ne sont pas bêtes; ils savent faire leurs choix et repérer les différences de qualité et n'ont pas besoin que l'on réduise l'assortiment de produits proposés pour ce faire. En effet, ces derniers savent lire les déclarations et la composition mentionnées sur les emballages. En abolissant le principe du ""Cassis de Dijon"", on prive le marché de certains produits d'entrée de gamme de toute façon disponibles dans les magasins de l'autre côté de la frontière, des magasins dans lesquels on ne trouve pas de produits agricoles suisses. Cela se traduira par des pertes de parts de marché pour notre agriculture et pour notre économie et nous pousserons ainsi une fois de plus le consommateur vers le tourisme d'achat qui, avec la situation liée à la force du franc, se chiffre à plus de 10 milliards de francs par année.
L'argument de la qualité est un prétexte pour un cloisonnement du marché suisse; un protectionnisme à l'égard de notre agriculture, ce dont celle-ci n'a pas besoin. Ce retour à l'ancien système contribue à maintenir un îlot de cherté. L'impact du principe du ""Cassis de Dijon"" sur les prix est difficile à évaluer, car le relevé des prix servant de base à ce que nous avons reçu a été effectué alors que le cours du franc s'était considérablement renforcé. De plus, en obligeant les fournisseurs à produire des séries spéciales limitées pour répondre aux prescriptions du petit marché suisse, nous leur donnerons l'occasion de surfacturer - ce qui est déjà le cas - les produits destinés à notre pays. Les organisations économiques, notamment l'Union suisse des arts et métiers, de même que la branche de l'hôtellerie et de la restauration ainsi que le commerce de détail, nous demandent de ne pas revenir à l'ancien système, car ce dernier est synonyme de hausse des prix et de diminution de la concurrence.
Politiquement, l'abolition du principe du ""Cassis de Dijon"" est un premier pas en faveur de l'initiative populaire des Verts qui veut imposer au monde entier les normes suisses de production pour permettre son importation. En excluant les denrées alimentaires du principe du ""Cassis de Dijon"", nous vidons de sa substance la loi fédérale sur les entraves techniques au commerce et nous donnons un signal de cloisonnement et d'isolement qui ne profitera à personne et qui sera synonyme d'augmentation des prix. Nous ne protégeons pas notre agriculture, qui n'est pas touchée par cette loi, mais nous réduisons la liberté de choix des consommateurs.
Je vous invite donc à soutenir la proposition de la minorité et à ne pas entrer en matière sur le projet de loi.
",N,20150506,4918,Mit-M,1.0,2015-05-06T11:03:54,2015-05-06T11:08:24,Mit-M,FR
260,181811,33342,453,"Monsieur Germanier, je ne vous ai pas entendu déclarer vos liens d'intérêts: êtes-vous toujours membre du conseil d'administration de Migros Valais?
",N,20150506,4918,Mit-M,1.0,2015-05-06T11:08:24,2015-05-06T11:08:36,Mit-M,FR
261,181812,33342,1117,"Monsieur Bugnon, la totalité des liens d'intérêts est bien sûr sur le site Internet du Parlement. Je suis membre du conseil d'administration de Migros Suisse. Je peux vous dire que c'est une entreprise qui s'occupe surtout de la transformation des produits agricoles en Suisse et qui n'est donc pas beaucoup concernée par le principe du ""Cassis de Dijon"". Elle ne commercialise par exemple pas de crème selon le principe du ""Cassis de Dijon"". Il n'y a donc pas d'impact.
",N,20150506,4918,Mit-M,1.0,2015-05-06T11:08:36,2015-05-06T11:09:03,Mit-M,FR
262,181813,33342,3872,"Monsieur Germanier, ne pensez-vous pas que l'application unilatérale du principe du ""Cassis de Dijon"" bafoue en définitive notre démocratie, nos institutions? Une fois que l'importation d'un produit est autorisée, les entreprises suisses peuvent produire selon les normes utilisées pour fabriquer le produit importé sans que la législation Suisse soit automatiquement modifiée ni que personne puisse recourir contre l'autorisation accordée. Seul celui qui a fait la demande peut recourir, mais il ne recourra bien évidemment pas contre l'aval donné par l'administration à sa propre demande d'importation.
",N,20150506,4918,Mit-M,1.0,2015-05-06T11:09:03,2015-05-06T11:09:34,Mit-M,FR
263,181814,33342,1117,"Je sais que le droit de recours des associations pour faire opposition a été discuté et n'est pas accepté intégralement. Ceci dit, le respect des normes prises en considération pour l'introduction d'un produit en Suisse est vérifié au niveau de l'Office fédéral de la santé publique. Au niveau de la sécurité, le contrôle est donc fait par l'administration fédérale.
",N,20150506,4918,Mit-M,1.0,2015-05-06T11:09:34,2015-05-06T11:10:03,Mit-M,FR
264,181815,33342,1293,"La bureaucratie liée au principe du ""Cassis de Dijon"" occupe six employés de la Confédération. Je pensais que le Parti libéral-radical était contre tout excès de bureaucratie. Aurait-il changé sa politique?
",N,20150506,4918,Mit-F,1.0,2015-05-06T11:10:03,2015-05-06T11:10:26,Mit-F,FR
265,181816,33342,1117,"Madame John-Calame, le Parti libéral-radical est surtout contre un cloisonnement du marché et contre un blocage de la concurrence au niveau de l'accessibilité des produits. Il veut que les consommateurs aient un choix et que la concurrence puisse fonctionner. Le principe du ""Cassis de Dijon"" ne touche pas la qualité - j'ai développé ce point. Le nombre de six employés peut en effet être discuté, mais sur la quantité d'employés de la Confédération qu'il y a dans le pays, cela ne fait pas une immense différence.
",N,20150506,4918,Mit-M,1.0,2015-05-06T11:10:26,2015-05-06T11:10:54,Mit-M,FR
266,181817,33342,4056,"Herr Kollege Germanier, ist meine Annahme richtig, dass Sie sich sonst, zum Beispiel bei Schweizer Wein, für eine Bevorzugung von Schweizer Produkten gegenüber ausländischen Produkten einsetzen?
",N,20150506,4918,Mit-M,1.0,2015-05-06T11:10:54,2015-05-06T11:11:09,Mit-M,DE
267,181818,33342,1117,"Ich bin sicher, dass der Schweizer Wein, der hundertprozentig mit Schweizer Trauben produziert wird, gegenüber allen Importweinen konkurrenzfähig ist. Alles ist offen für diese Weine - ich will keinen Protektionismus für Schweizer Wein, das bringt nichts. Unser Wein hat die Qualität, um auf dem Markt bestehen zu können, und wir haben immer mehr Erfolg mit Schweizer Wein.
",N,20150506,4918,Mit-M,1.0,2015-05-06T11:11:09,2015-05-06T11:11:35,Mit-M,DE
255,181806,33342,3924,"Monsieur Germanier, seriez-vous toujours favorable à ce principe si, un jour, un pays d'Europe autorisait la commercialisation de vin composé pour moitié d'eau et que, grâce au principe du ""Cassis de 'pigeon'"", on pouvait le vendre en Suisse avec la dénomination ""Vin de table""?  
",N,20150506,4918,Mit-M,1.0,2015-05-06T11:11:35,2015-05-06T11:12:01,Mit-M,FR
254,181805,33342,1117,"Nous ne pourrions pas le faire, Monsieur van Singer, car l'appellation ""suisse"" doit répondre aux prescriptions suisses. Nous sommes dans le domaine des appellations d'origine protégées, donc vous êtes à côté du sujet en parlant de cela. La reconnaissance de produits suisses au niveau de l'Union européenne n'est pas un problème qui se pose concrètement. Le vin suisse est de toute façon pur, protégé et, en vertu des prescriptions suisses, en aucun cas nous ne pourrions appeler ""suisse"" un tel produit.
Il existe en effet des nouveaux produits sur le marché, par exemple des ""wine coolers"". Le consommateur sait ce qu'il achète; il n'est pas bête; il lit les étiquettes; il connaît la composition du produit et il choisit la qualité. L'agriculture suisse est capable de s'imposer par la qualité de ses produits, en convainquant le consommateur.
",N,20150506,4918,Mit-M,1.0,2015-05-06T11:12:01,2015-05-06T11:12:57,Mit-M,FR
