,ID,IdSubject,PersonNumber,Text,MeetingCouncilAbbreviation,MeetingDate,IdSession,SpeakerFunction,CouncilId,Start,End,Function,LanguageOfText
157,174066,30919,4051,"Gestatten Sie mir einige einleitende Bemerkungen zur weiteren Beratung. Ich möchte der guten Ordnung halber auch meine Interessenbindung offenlegen: Ich bin Präsident von Intergenerika.
Die Kommission hat die Differenzen zur Änderung des Heilmittelgesetzes an drei Sitzungen von Januar bis April 2015 beraten. Die Kommission beantragt Ihnen im Grundsatz, dass wir bei unseren bisherigen Beschlüssen bleiben. Der Ständerat schloss sich als Zweitrat eher der ursprünglichen Fassung des Bundesrates an. Wir beantragen Ihnen jedoch, bei den Punkten der Zulassung, der Forschungsanreize und der transparenteren Marktregulierung bei den Verbesserungen, die wir als Erstrat beschlossen hatten, zu bleiben.  
Die Kommission stellt unserem Rat konkret folgende Anträge: Die Forschung für Arzneimittel gegen seltene Krankheiten sollte gestärkt werden. Die Pharmafirmen in diesen Bereichen sollen forschen und neue Therapien auf den Markt bringen. Sie sollen dazu auch mit einem Vorteil, einem Anreiz ermuntert werden. In den USA und in der EU hat sich das Instrument der Marktexklusivität bewährt. Wir beantragen Ihnen darum mit 14 zu 10 Stimmen bei 1 Enthaltung, in Artikel 12a dieses Instrument beizubehalten.
Die Arzneimittel, die vergleichbar sind mit Medikamenten, die seit mindestens zehn Jahren in einem EU- oder Efta-Land auf dem Markt sind, sollen in der Schweiz vereinfacht zugelassen werden. Die Kommission beantragt Ihnen einstimmig, bei der vereinfachten Zulassung weiter zu gehen, als der Ständerat dies in Artikel 14 getan hat.
Mit 12 zu 6 Stimmen bei 1 Enthaltung unterstützt die Kommission eine vom Ständerat neuaufgenommene Bestimmung, die verhindern soll, dass Arzneimittel aus der Schweiz im Ausland für Hinrichtungen verwendet werden.
Mit klarer Mehrheit hält die Kommission daran fest, dass Ärzte grundsätzlich ein Arzneimittelrezept ausstellen müssen, damit die Patienten selbst bestimmen können, wo sie ein Medikament beziehen. Was die Versandapotheken betrifft, will die Kommission im Gesetz ausdrücklich festhalten, dass vor der Bestellung ein ärztliches Rezept vorliegen muss. Im Kampf gegen Antibiotikaresistenzen unterstützt die Kommission einhellig die vom Ständerat eingeführte Bestimmung über eine Antibiotikadatenbank in der Veterinärmedizin. 
Über die Regelung der geldwerten Vorteile werden wir uns ausführlich unterhalten. Die Mehrheit beantragt nach einlässlicher Diskussion, in den grossen Linien den bisherigen Beschlüssen des Nationalrates zu folgen. Die Mehrheit der Kommission hält es für wichtig, mit dem Verbot nichtgebührender Vorteile alle Heilmittel zu erfassen, nicht nur die verschreibungspflichtigen Arzneimittel wie der Ständerat. Was die von der obligatorischen Krankenversicherung vergüteten Arzneimittel betrifft, beantragt die Kommission, dass die beim Einkauf gewährten Vergünstigungen ""im Wesentlichen"" an die Kostenträger weitergegeben werden.
Schliesslich hält die Kommission daran fest, dass eine Stiftung, die von Pharmaunternehmen, Ärzten, Apothekern, Drogisten sowie den Patienten getragen wird, für die Publikation der Arzneimittelinformationen besorgt sein soll.
",N,20150504,4918,Mit-M,1.0,2015-05-04T14:34:36,2015-05-04T14:37:51,*,DE
159,174068,30919,3830,"Es geht hier um einen sehr wichtigen Artikel des Heilmittelgesetzes. Er ist sehr technisch und wird, wenn er in der Fassung der Kommissionsmehrheit angenommen wird, sehr schwer wiegende Folgen haben.
Die Mehrheit des Nationalrates will ein staatlich geschaffenes Monopol für Pharmaunternehmen, die sogenannte Marktexklusivität, einführen. Diese Marktexklusivität wird die Entwicklung anderer und kostengünstigerer Arzneimittel für dieselbe Anwendung verunmöglichen, dafür aber der Pharmaindustrie grössere Margen bescheren. Seit der Einführung der Marktexklusivität sind in anderen Ländern, insbesondere in Europa und in den USA, die Preise für die Medikamente gegen seltene Krankheiten stark gestiegen. Die Pharmaindustrie wird also einseitig davon profitieren, während für die Patienten keine nennenswerten Vorteile erzielt werden.
Ich anerkenne die Notwendigkeit, Innovationen in der medikamentösen Behandlung von seltenen Erkrankungen angemessen zu belohnen. Aber dies muss ohne negative Folgen für die Forschungs- und Entwicklungsarbeit weiterer Marktteilnehmer sowie für die Kostenentwicklung geschehen. Deshalb unterstütze ich neben der Strategie des Bundesrates zu seltenen Krankheiten auch einen verlängerten Unterlagenschutz für die Zulassung eines Medikamentes. Im Gegensatz zur Marktexklusivität verhindert der Unterlagenschutz nicht, dass ein anderes Unternehmen in die Entwicklung oder auch Weiterentwicklung eines Produktes investieren kann.
Die Marktexklusivität wäre für die Schweiz zudem ein ganz neues Instrument, welches das gesamte Anwendungsgebiet eines Arzneimittels schützt. Dies hätte zur Folge, dass die Zulassung von anderen Arzneimitteln für dasselbe Anwendungsgebiet während eines Zeitrahmens von zehn Jahren - oder von zwölf Jahren bei einer pädiatrischen Indikation - verboten wird. Die Einführung der Marktexklusivität würde keinen Wettbewerb bei Arzneimitteln mit bekannten Wirkstoffen zulassen. Bewährte Arzneimittel, die seit Längerem für verschiedene Indikationen zugelassen sind, könnten kaum in neuen, seltenen Anwendungsgebieten angewandt und, wäre dies einmal der Fall, nur zu deutlich höheren Preisen verkauft werden.
Mit meinem Minderheitsantrag zu Artikel 11b Absatz 4 und dem damit verbundenen Minderheitsantrag zu Artikel 12a will ich die Monopolisierung der Herstellung, die garantierten grösseren Margen für die Pharmaindustrie und die daraus folgenden Preiserhöhungen für bestimmte Medikamente verhindern. Der Notwendigkeit der medikamentösen Behandlung von seltenen Erkrankungen soll Rechnung getragen werden, indem der Unterlagenschutz in Artikel 11b bei seltenen Krankheiten erhöht wird. Diese Lösung entspricht dem Beschluss des Ständerates, der bei den seltenen Krankheiten ebenfalls beim Unterlagenschutz bleiben will.
Ich bitte Sie, meinen Minderheitsanträgen zu Artikel 11b Absatz 4 und zu Artikel 12a zuzustimmen.
",N,20150504,4918,Mit-F,1.0,2015-05-04T14:39:02,2015-05-04T14:42:22,Mit-F,DE
160,174069,30919,3931,"Sie wissen, die Minderheit will bei Artikel 11b Absatz 4 einen klaren, konsequenten Schutz der Unterlagen von Arzneimitteln für seltene Krankheiten, einen Schutz in der Regel von zwölf Jahren, der aber auf Antrag hin auf fünfzehn Jahre ausgedehnt werden kann. Diese Version haben wir bereits in der ersten Debatte diskutiert, allerdings mit einer geringeren Anzahl Jahre. Der Ständerat hat  hier die Fristen etwas nach oben korrigiert. Die Mehrheit will aber nicht den Unterlagenschutz, sondern sie setzt auf die sogenannte Marktexklusivität. Aber es ist eine beschränkte Marktexklusivität, denn wenn ein ähnliches Medikament auf den Markt gebracht werden soll, dann muss es sicherer und wirksamer sein als das bereits zugelassene Präparat. Somit handelt es sich bei der Lösung der Marktexklusivität um eine Scheinlösung. Einerseits wird der Schutz der bestehenden Arzneimittel geschwächt, andererseits wird kaum ein Forschungsanreiz gesetzt, um in Bereichen, wo es bereits etwas gibt, neue Medikamente zu entwickeln.
Wir von der Grünliberalen Partei sind für starke Anreize für die Entwicklung von Arzneimitteln für seltene Krankheiten und werden deshalb die Minderheit unterstützen.
",N,20150504,4918,Mit-M,1.0,2015-05-04T14:42:22,2015-05-04T14:44:24,Mit-M,DE
161,174070,30919,4126,"Weil der Markt meist zu klein ist, um hohe Forschungskosten zu rechtfertigen, werden in der Schweiz viel zu wenig Medikamente gegen seltene Krankheiten entwickelt. In der Forschung für diese seltenen Krankheiten sind wir in der Schweiz im wahrsten Sinne des Wortes Trittbrettfahrer: Die USA haben schon 1983 mit dem Orphan Drug Act eine Marktexklusivität für Medikamente gegen seltene Krankheiten geschaffen, und die so viel kritisierte EU hat im Jahre 2000 nachgezogen. Man kann sich selbstverständlich auf den Standpunkt stellen, dass es uns eigentlich recht ist, wenn sich die anderen engagieren, dass wir also nichts unternehmen müssen. Wir, ich und die FDP/die Liberalen, sind da ganz anderer Meinung: Wir treten ein für die Forschungsanreize.
Der Anreiz ist hier tatsächlich eine Marktexklusivität von zehn Jahren, ein Monopol. Und ja, ein Monopol an sich gefällt uns nicht. Aber es ist kein absolutes Monopol: Sobald ein besseres oder sichereres Medikament entwickelt wird, bricht dieses Monopol, wird das Monopol obsolet, denn der Patient, die Patientin hat selbstverständlich das Anrecht auf das beste oder das sicherste Medikament.
Der Anreiz, der in den USA und in der EU geschaffen worden ist, funktioniert: Dank der Vorreiterrolle dieser beiden verfügen wir heute über wesentlich mehr Arzneimittel gegen seltene Krankheiten als noch vor zwanzig Jahren. Das kommt in allererster Linie unseren Patientinnen und Patienten zugute. Wir alle wissen nicht, ob wir nicht morgen selber zu einer Gruppe gehören, die eine dieser seltenen Krankheiten hat.
Dasselbe gilt im Übrigen für neue Indikationen. Wir haben heute ein echtes Problem. Die Anreize für die Erforschung neuer Indikationen bekannter Medikamente genügen nicht, vor allem wenn die Medikamente schon länger auf dem Markt sind. Es gibt eine Reihe von Krankheitsgebieten, zum Beispiel antimikrobielle Resistenzen, Krankheiten des zentralen Nervensystems wie Depressionen, in denen wir alle, Ärzte und Patientinnen und Patienten, dringend auf neue Medikamente warten. Die Forschung stellt aber immer mehr fest, dass ein bestimmter Wirkstoff bei zum Teil ganz anderen Krankheiten seine Wirkung entfalten kann. Das Problem ist, dass man kaum bereit ist, hier in die risikoreiche Forschung Millionen, wenn nicht Milliarden von Franken zu investieren, wenn das Patent dieser Substanz bald abläuft oder gar schon abgelaufen ist.
Ein Wort noch zu den vielzitierten Kosten, auch wenn dies eigentlich ein anderes Thema ist:
1. Ob ein Medikament als Orphan Drug anerkannt wird, entscheidet Swissmedic und nicht die Pharmafirma. Sollte ein Missbrauch betrieben werden, ist es an Swissmedic, dies zu unterbinden. 
2. Die Medikamentenpreise bilden sich ja nicht frei am Markt, sondern es sind administrierte Preise; es ist also Verhandlungssache. Auch hier hat der Staat zu Recht die Möglichkeit einzuschreiten, und das tut er ja auch, wie wir den alljährlichen Diskussionen entnehmen können. 
3. Auch die Möglichkeiten, ein Medikament zu beziehen, können eingeschränkt werden. Ich erinnere hier nur zum Beispiel an die Diskussion um die sehr wirkungsvollen, aber sehr teuren Medikamente gegen Hepatitis C; es braucht heute sehr viel, damit man eines dieser teuren Medikamente bekommt. Nur wenn meine Leber schon völlig zerstört ist, kann ich diese Medikamente beziehen, die sehr teuer sind. Auch hier hat also der Staat Möglichkeiten einzuschreiten.
Wie hoch sind denn heute die Kosten dieser Orphan Drugs? Laut der Versicherung Helsana machen sie rund 2,5 Prozent der Kosten aus - 2,5 Prozent der Kosten! Was die Zukunft insgesamt bringt, wissen wir selbstverständlich nicht. Bei den Kosten - da müssen wir ehrlich sein - wird es am Schluss eine Frage der Rationierung sein. Dies wird eine schwierige Diskussion werden, auch für uns. Aber die Diskussion wird kommen: Werden Medikamente oder Operationen rationiert oder nicht?
Aber um all das geht es hier an sich nicht, sondern hier geht es nur darum, ein Zeichen für die Forschung, für den Forschungsstandort Schweiz zu setzen oder eben nicht. Ich bitte Sie im Namen der FDP-Liberalen Fraktion, dieses Zeichen für unseren Forschungsstandort zu setzen und damit auch etwas für unsere Arbeitsplätze zu tun. 
",N,20150504,4918,Mit-M,1.0,2015-05-04T14:44:24,2015-05-04T14:48:55,Mit-M,DE
162,174071,30919,1071,"Die CVP/EVP-Fraktion wird bei diesen Artikeln - Artikel 11b, ""Unterlagenschutz in Spezialfällen"", und Artikel 12a, ""Marktexklusivität"" - der Kommissionsmehrheit folgen. Damit werden die Rahmenbedingungen für die biomedizinische Forschung verbessert, und damit wird auch der Zugang für Menschen mit seltenen Krankheiten oder Kinderkrankheiten zu wirksamen Arzneimitteln verbessert.
Handlungsbedarf im Bereich der biomedizinischen Forschung wird auch im Bericht des Bundesrates ""Massnahmen des Bundes zur Stärkung der biomedizinischen Forschung und Technologie"" erkannt, und entsprechende Massnahmen werden vorgeschlagen. Es wird in diesem Bericht explizit auf den Mangel im Bereich der Forschung bezüglich Medikamenten für seltene Krankheiten hingewiesen. Mit der Einführung einer Marktexklusivität betritt die Schweiz keineswegs Neuland. Vielmehr passen wir uns an die Regulierungen der EU und des amerikanischen Rechts an. Sowohl die EU wie auch die USA kennen dieses Recht seit Jahren, und es wird im erwähnten Bericht auf die Vor- und Nachteile des Marktexklusivitätsrechts in den USA und in der EU hingewiesen. Die Rechtsexperten kommen zum Schluss, dass die Verleihung des Marktexklusivitätsrechts in der Schweiz der Rechtsvereinheitlichung diene und einen gewissen Symbolcharakter habe.
Bedenken gibt es zu den Kostenfolgen. Ich möchte da aber darauf hinweisen, dass die Forschungsförderung und die Vergütung von Medikamenten zwei unterschiedliche Fragen sind. Es geht in Artikel 12a um die Förderung von Arzneimitteln für seltene Krankheiten und damit um die Frage, wie wir die Förderung von Medikamenten für seltene Krankheiten vornehmen wollen - oder ob wir sie nicht wollen. Es geht nicht um die Frage der Medikamentenpreise, für welche ja das Bundesamt für Gesundheit zuständig ist.
In Artikel 4 Absatz 1 Buchstabe adecies des Gesetzes ist die Definition von Orphan Drugs oder von Arzneimitteln für seltene Krankheiten festgehalten. Es geht um Medikamente für seltene Krankheiten im engen Sinn. Es geht um Krankheiten, die lebensbedrohend oder chronisch invalidisierend sind und wenige Menschen betreffen. Es geht nicht um Subtypen von insgesamt häufigen Krankheiten, insbesondere Tumorerkrankungen. Eine Marktexklusivität kann also nur bei Arzneimitteln für seltene Krankheiten angewendet werden. Der Markt bei seltenen Krankheiten ist so klein, dass es uninteressant ist, ihn mit anderen Marktakteuren zu teilen. Zudem würden nur klinisch gleichwertige Produkte nicht zugelassen, klinisch bessere Medikamente hingegen schon.
Der Preis eines Medikamentes ist hingegen eine andere Frage. Forschungsanreize und Vergütung haben direkt nichts miteinander zu tun. Über die Vergütung entscheidet das BAG aufgrund der KVG-Bestimmungen und der entsprechenden Verordnungen erst, wenn ein Medikament existiert und dieses von Swissmedic zugelassen und auch als kassenpflichtig anerkannt worden ist.
Die Marktexklusivität ist ein positives Signal für den Pharma- und Forschungsstandort Schweiz; sie schafft einen Anreiz  für vermehrte Forschung im Bereich der seltenen Krankheiten und nützt daher auch den betroffenen Patientinnen und Patienten! Deshalb stimmt die CVP/EVP-Fraktion mit der Mehrheit.
",N,20150504,4918,Mit-F,1.0,2015-05-04T14:48:55,2015-05-04T14:53:15,Mit-F,DE
163,174072,30919,3881,"Es ist weitgehend unbestritten, dass in Spezialbereichen des Unterlagenschutzes eine Verstärkung notwendig ist, damit überhaupt Heilmittel entwickelt und zur Zulassung angemeldet werden. Dies gilt insbesondere für Medikamente in der Kinderheilkunde und für Medikamente zur Behandlung von seltenen Krankheiten. Der Bundesrat beantragte Ihnen deswegen eine Verlängerung des Unterlagenschutzes auf zwölf Jahre. Der Ständerat erweiterte diese Möglichkeit sogar, indem er beschloss, dass der Unterlagenschutz während bis zu fünfzehn Jahren gewährt werden kann. 
Die nationalrätliche Kommission ging jetzt noch weiter und führte die Marktexklusivität ein. Damit wird die Konkurrenz vollständig ausgeschaltet, da Zweitanmeldungen für die gleiche therapeutische Indikation während zehn Jahren ausgeschlossen sind. Es geht bei der Marktexklusivität eben nicht darum, wie es meine Vorrednerin gesagt hat, ob man überhaupt Medikamente gegen seltene Krankheiten zur Verfügung hat oder nicht. Es geht darum, dass eine absolute Monopolstellung geschaffen wird. Es geht nicht darum, ob die Entwicklung dieser Medikamente lohnenswert ist, sondern darum, ganz spezielle Gärtchen einzelner Grossunternehmen zu schützen. Diese wissen sehr genau, wie sie marktwirtschaftlich agieren müssen, um aus solchen Medikamenten auch ""Kollateralgewinne"" zu generieren, neue Behandlungskategorien zu schaffen, um nachher den entsprechenden Schutz auch für die gleiche therapeutische Indikation möglichst maximal zu ihren Gunsten zu nutzen.
Es ist schon erstaunlich, dass mit der Marktexklusivität ein Weg beschritten wird, mit dem Monopolstellungen geschaffen werden - in einer Welt der Marktwirtschaft, unter geregelten Rahmenbedingungen. Immerhin könnte sich ja grundsätzlich jedes Unternehmen auch in die Lage bringen, ein Konkurrenzprodukt zu jenem des Erstanmelders auf den Markt zu bringen. Offenbar scheint das in der Praxis im Sinne der Spezialisierung mit Blick auf Konkurrenzunternehmungen nicht mehr relevant zu sein. Dass andere Länder diese Praxis bereits anwenden, heisst ja noch nicht, dass dies ein Gütezeichen für einen gesetzlichen Nachvollzug in der Schweiz ist. Die jetzt zusätzlich geforderte Marktexklusivität schafft sehr problematische Monopolstellungen, die in ihrer Konsequenz nicht nur den freien Markt massiv einschränken, sondern auch Innovationen zugunsten der betroffenen Patientinnen und Patienten verhindern.
Die Grünen bitten Sie deshalb, dem ständerätlichen Konzept zu folgen und den Anträgen der Minderheit Carobbio Guscetti zuzustimmen.
",N,20150504,4918,Mit-F,1.0,2015-05-04T14:53:15,2015-05-04T14:57:01,Mit-F,DE
164,174073,30919,1156,"Eines der zentralen Ziele dieser Revision des Heilmittelgesetzes ist es, eine grössere Vielfalt an Kindermedikamenten, an kindergerechten Medikamenten verfügbar zu machen und die Entwicklung neuer Therapien gegen seltene Krankheiten attraktiver zu machen, also diesbezüglich Versorgungslücken zu schliessen. Dazu gibt es das Konzept ""Verlängerung des Unterlagenschutzes"": Die pharmazeutische Industrie soll für den höheren Aufwand für die Entwicklung und vertiefte Prüfung von Kinderarzneimitteln von einem verlängerten Schutz der Forschungsunterlagen profitieren. Artikel 11b Absatz 2bis legt das so fest: Die Schutzdauer der Unterlagen zur neuen Indikation wird von fünf auf zehn Jahre verdoppelt, ""wenn ein bedeutender klinischer Nutzen gegenüber bestehenden Therapien erwartet werden kann"". Handelt es sich um ein Arzneimittel für seltene Krankheiten, soll der Unterlagenschutz nach Artikel 11b Absatz 4 sogar auf zwölf Jahre verlängert werden. Und wird das Arzneimittel einem pädiatrischen Prüfkonzept unterzogen, wird der Unterlagenschutz im Vergleich zum geltenden Gesetz verdreifacht, das heisst auf fünfzehn Jahre erweitert.
Nach der bisherigen Mehrheit unseres Rates und unserer Kommission scheint das aber immer noch nicht zu genügen: Es soll, anders, als das der Ständerat beschlossen hat, zusätzlich zur vervielfachten Dauer des Unterlagenschutzes noch die Marktexklusivität eingeführt werden - für die Schweiz ein neues Instrument. Die Frage sei hier gestellt: Braucht unsere starke, erfolgreiche Pharmaindustrie wirklich auch noch diese Unterstützung? Ist das für sie nicht eher ein ""nice to have"" - ein ""nice to have"" mit unter Umständen sehr hohen Kostenfolgen für die Versicherten, leider aber nicht unbedingt mit einem Mehrnutzen für die Förderung neuer Therapien gegen seltene Krankheiten?
Was ist der wirkliche Effekt der Marktexklusivität? Erstens schafft sie faktisch ein zehnjähriges Monopol, das Konkurrenten davor abschrecken soll, in einem ähnlichen Bereich Forschungen voranzutreiben. Zweitens führt sie - das zeigt ein Blick auf die USA - zu einer enormen Preisexplosion bei Therapien mit Medikamenten, die das Off-Label tragen, nach der Gleichung: je seltener die Krankheit, desto teurer das Medikament. Die Medizin entdeckt immer mehr Untergruppen bestimmter Krankheiten. Somit werden die Zahl seltener Krankheiten und die Zahl der Spezialtherapien unter dem Off-Label stetig zunehmen. Ich sage: zum Glück für die Patientinnen und Patienten. Sie können damit auf immer spezifischere und gezieltere Behandlungen hoffen. Auf der anderen Seite treibt das Monopol durch die Marktexklusivität die Preise in die Höhe. Die Quintessenz sind explodierende Preise und eine forcierte Bremse für die Konkurrenz, für die Forschung, die uns ja eigentlich ein wichtiges Anliegen ist. So lassen sich weder Gesundheitskosten dämpfen, noch lässt sich die Forschung im Bereich seltener Krankheiten voranbringen, im Gegenteil: Sie wird gebremst. 
Deshalb lehnt die SP-Fraktion die Marktexklusivität und damit Artikel 12a ab. Das tut ja auch der Ständerat. Die SP-Fraktion fordert den Rat auf, wie die SP, wie der Ständerat die Marktexklusivität abzulehnen.
Ich bitte Sie: Folgen Sie bei beiden Artikeln der Minderheit Carobbio Guscetti und damit dem Ständerat. Sie tun etwas Gutes für die Patientinnen und Patienten wie auch für die Versicherten.
",N,20150504,4918,Mit-F,1.0,2015-05-04T14:57:01,2015-05-04T15:01:16,Mit-F,DE
165,174074,30919,4042,"Ich bitte Sie, hier dem Antrag der Kommissionsmehrheit zuzustimmen. 
Der Ständerat hat die Einführung der Marktexklusivität für Arzneimittel für seltene Krankheiten abgelehnt. Er möchte wie auch der Bundesrat bei den seltenen Krankheiten am Unterlagenschutz festhalten; bei Kinderarzneimitteln möchte er diesen sogar auf fünfzehn Jahre erhöhen. Das ist zwar sehr gut gemeint, aber nicht der richtige Weg. In den USA und in der EU hat man das erkannt. Seit Einführung der Marktexklusivität in den USA im Jahre 1983 sind über 400 neue Medikamente für seltene Krankheiten zugelassen worden; zuvor standen ganze zehn Medikamente zur Verfügung.
Warum genügt denn der Unterlagenschutz nicht? Viele meiner Vorredner haben gesagt, dass dieser so gut sei und dass die Pharmaunternehmen, wenn man den Unterlagenschutz noch verbessere, forschen würden. Der Punkt ist: Pharmaunternehmen sind keine sozialen Einrichtungen. Sie forschen nur, wenn sie Gewinn erwarten. Wenn es bei einer Krankheit nur sehr wenige Patienten gibt, bietet der Unterlagenschutz nicht genügend Anreize zum Forschen. Die Pharmaunternehmen werden nämlich gar nicht tätig. Sie wollen sich einen kleinen Markt nicht noch mit anderen teilen müssen.
Damit es überhaupt zu neuen Medikamenten für seltene Krankheiten kommt, braucht es ein Monopol. Dieses wird durch die Marktexklusivität geschaffen. Diese gewährleistet, dass kein zweites gleichwertiges Medikament auf den Markt kommt. Nur ein solches Monopol gewährleistet, dass Patienten, die an seltenen Krankheiten leiden, von neuen Medikamenten profitieren können.
Nun, man darf bei der Marktexklusivität auch nicht zu weit gehen. Eine absolut verstandene Marktexklusivität wäre dann nicht im Sinne der Patientinnen und Patienten, wenn  sie die Einführung neuer und besserer Medikamente verhindern würde. Deshalb muss ein neues Medikament eben doch zugelassen werden, wenn es nachweislich sicherer oder wirksamer oder dem bereits zugelassenen Medikament anderweitig klinisch überlegen ist. Das steht so in Artikel 12a des Heilmittelgesetzes.
Stärken Sie also den Forschungsstandort Schweiz, helfen Sie Patienten und Patientinnen, die an seltenen Krankheiten leiden, dass Medikamente entwickelt werden, die ihnen nützen und die ihnen helfen, wieder gesund zu werden. Folgen Sie deshalb der Mehrheit Ihrer Kommission!
",N,20150504,4918,Mit-M,1.0,2015-05-04T15:01:16,2015-05-04T15:04:47,Mit-M,DE
