,ID,IdSubject,PersonNumber,Text,MeetingCouncilAbbreviation,MeetingDate,IdSession,SpeakerFunction,CouncilId,Start,End,Function,LanguageOfText
538,186136,34820,508,"Im Jahr 2014 haben die Zivildienstleistenden 1,5 Millionen Diensttage geleistet. Ich war anfänglich, als ich ins Mandat kam, dem Zivildienst gegenüber relativ skeptisch eingestellt. Ich bin zwischenzeitlich zur Überzeugung gelangt, dass die Zivildienstleistenden engagierte junge Bürger sind, die sich für dieses Land einsetzen. Sie leisten einen grossen und wichtigen Beitrag im öffentlichen Interesse, dies vor allem im Pflegebereich und bei der Betreuung von Menschen, aber auch im Umweltbereich. Ich zolle den Zivildienstleistenden meine Anerkennung. 
Lassen Sie mich ein paar wenige Bemerkungen zum Umfeld machen: Der Zivildienst ist in ein Umfeld eingebettet, insbesondere in die Sicherheitspolitik und ins Dienstpflichtsystem unseres Landes. Der Bundesrat hat am 25. Juni 2014 den dritten Bericht zu den Auswirkungen der Tatbeweislösung beim Zivildienst verabschiedet, und dieser Bericht kam zu klaren Schlüssen:
1. Der Zivildienst gefährdet die Armeebestände nicht. 
2. Der Zivildienst trägt zur Wehrgerechtigkeit bei. Praktisch alle Zivildienstleistenden leisten alle verfügten Diensttage. Sie erfüllen die Dienstpflicht zu 98 Prozent, und sie wählen nicht den ""blauen Weg"".
3. Es sind aus der Sicht des Bundesrates keine zusätzlichen Massnahmen nötig, um die Zahl der Zulassungen zu senken. Die Zulassungszahl hat sich etwa auf dem Niveau von 2013 stabilisiert. Es waren, wie es auch schon gesagt wurde, in den Jahren 2013 und 2014 in der Grössenordnung 5500 bis 5700 Zivildienstleistende. 
Der dritte Bericht hat klar gezeigt, dass der Zivildienst die Armee und ihre Bestände nicht gefährdet - noch einmal -; der Zivildienst ist also keine Konkurrenz für die Armee. Beide betreffen dieselbe Pflicht gemäss unserer Verfassung. Auch der Zivildienst ist verfassungsbasiert. Würden wir die Attraktivität des Zivildienstes weiter senken, würden wir der Armee keinen Dienst leisten. Im Gegenteil, wir würden die Wehrgerechtigkeit schwächen, weil davon auszugehen ist, dass häufiger der ""blaue Weg"" beschritten würde.
Im Zusammenhang mit dem gesamten Dienstpflichtsystem stellen sich aber auch Fragen. Diese Fragen betreffen die Armee, sie betreffen den Zivildienst, den Zivilschutz, den ""blauen Weg"", die Wehrpflichtabgabe und das Verhältnis aller zueinander in einem gesamtgesellschaftlichen Zusammenhang. Diese Fragen können wir nicht einseitig im Zivildienstgesetz beantworten, vielmehr sei daran erinnert, dass sich die Studiengruppe Dienstpflichtsystem unter der Federführung des VBS mit den Fragen beschäftigt.
Ein Wort zur Arbeitsmarktneutralität, und das ist mir als Wirtschaftsminister natürlich wichtig, ich bin mir selbstverständlich der Bedeutung der Arbeitsmarktneutralität bewusst: Die Vollzugsstelle arbeitet mit den kantonalen Arbeitsmarktbehörden intensiv zusammen, und von da werden kaum Probleme gemeldet. Einen grundsätzlichen gesetzgeberischen Handlungsbedarf bei Zivildiensteinsätzen gibt es diesbezüglich also nicht. Einzelne wenige kritische Fälle überprüft die Vollzugsstelle für den Zivildienst konsequent, und dann wird auch wenn nötig Abhilfe geschaffen.
Zum Stichwort Jugendarbeitslosigkeit: Der Zivildienst hat einen positiven Einfluss auf die Beschäftigungschancen und auch auf die Berufswahl. Das zeigt sich in verschiedenen Abfragen. Nicht wenige ""Zivis"" wählen dank dem Zivildienst ihren künftigen Beruf, und zwar insbesondere auch im Bereich der Pflege und im Bereich der Betreuung. 
Zur Fachkräfte-Initiative: Viele ""Zivis"" leisten Einsätze in Kinderbetreuungsstrukturen, also in Krippen. Damit trägt der Zivildienst dazu bei, dass die Vereinbarkeit zwischen Beruf und Familie besser gestaltet werden kann.
Was wollen wir nun in diesem Umfeld mit der Änderung des Zivildienstgesetzes erreichen? Das primäre Ziel ist wie gesagt nicht, die Anzahl der Zulassungen zu senken. Die Revision hat drei gute Gründe: 
1. Es geht um das Verbessern der Ausbildung der ""Zivis"". Es geht insbesondere um die Intensivierung der Ausbildung in der Pflege und Betreuung. Damit können wir den Nutzen der Zivildiensteinsätze steigern, und wir setzen damit die Motion Müller Walter um.
2. Wir passen das Zivildienstgesetz an die Agrarpolitik 2014-2017 an.
3. Wir optimieren den Vollzug.
Ich will zwei wichtige Optimierungsbereiche in aller Kürze antippen:
1. Das strengere Zulassungsverfahren: Mit mehreren Massnahmen gestalten wir den Zivildienst strenger. Wir wirken damit auch dämpfend auf die Anzahl Zulassungen. Ich will Ihnen zwei Punkte dazu liefern, nämlich zum einen das Zulassungsverfahren per se. Heute werden die ""Zivis"" nach  der Zulassung in ihre Rechte und Pflichten eingeführt. Künftig müssen die Gesuchsteller einen Einführungstag besuchen und danach ihr Gesuch bestätigen, bevor sie zugelassen werden. Der Einführungstag wird nicht als Diensttag angerechnet. Was ist der Zweck? Die ""Zivis"" sollen sich intensiv mit den Konsequenzen befassen müssen, bevor sie zugelassen werden. Zum andern sollen die ""Zivis"" für die Benützung der Privatunterkunft keine Entschädigung mehr erhalten; auch das ist eine Erhöhung der Hürden. 
2. Die Optimierung des Vollzugs, Stichwort Auslandeinsätze: Auslandeinsätze hat es immer gegeben. Sie leisten insbesondere Beiträge in der Entwicklungszusammenarbeit und in der humanitären Hilfe, auch im Zusammenhang mit Katastrophen und Notlagen und in der zivilen Friedensförderung; das soll gemäss Bundesrat so bleiben. Die Revision von Artikel 7 präzisiert die Rahmenbedingungen und dient insbesondere dazu, auf Verordnungsebene die Anforderungen an ""Zivis"" und Einsatzbetriebe zu erhöhen. Die Anforderungen sind allerdings heute schon höher als für Einsätze im Inland. Kein ""Zivi"" hat Anspruch auf einen Einsatz im Ausland, und umgekehrt kann natürlich auch kein ""Zivi"" dazu gezwungen werden. 
Die Tätigkeit in den Schulen ist der einzige Punkt der Vorlage, bei dem Ihre Sicherheitspolitische Kommission dem Bundesrat nicht gefolgt ist. Gemäss Bundesrat sollen ""Zivis"" Schulen und Lehrkräfte unterstützen. Sie gefährden damit nicht Arbeitsplätze, sie werden nicht selbst die Verantwortung für den Unterricht übernehmen, sie werden also nicht Lehrkräfte ersetzen. Schulen, Gemeinden und Kantone sollen ""Zivis"" nur dann einsetzen dürfen, wenn diese das auch wirklich wollen und die vorgesetzten Instanzen, also Schulen, Gemeinden und Kantone, das ihrerseits wünschen. Der Vorstand der EDK hat sich positiv zur Möglichkeit des Einsatzes von ""Zivis"" in Schulen geäussert.
Ich gehe noch ganz kurz auf Artikel 16 Absatz 2 ein. Da sind wir bei der Thematik, wann ein Gesuch eingereicht werden kann. Das herkömmliche System besagt, dass jederzeit ein Gesuch eingereicht werden darf. Der Bundesrat will daran nichts ändern, und Ihre Sicherheitspolitische Kommission ist ihm nach intensiver Diskussion verschiedenster Varianten dann auch gefolgt. Eine Einschränkung des ""jederzeit"" würde nichts nützen, es würde eher schaden, und es würde vor allem auch die Wehrgerechtigkeit schwächen, weil die Betroffenen auf dem ""blauen Weg"" abschleichen könnten. Es wäre kontraproduktiv für die Armee, und es würde das Gleichgewicht, das sich nun einpendelt, stören. Eine Einschränkung des ""jederzeit"" wäre keine Optimierung des Vollzugs, sondern eine Verschlechterung mit gravierenden Folgen. Dasselbe gilt für alle anderen Anträge, die die Attraktivität des Zivildienstes weiter senken wollen. 
Ich fasse zusammen: Die Revisionsvorlage ist notwendig, und sie ist ausgewogen. Sie bringt eine ganze Reihe Optimierungen. Wir steigern den Nutzen der Zivildiensteinsätze, wir steigern die Wirkung der neuen Agrarpolitik, wir gewährleisten weiterhin einen effizienten Vollzug und anspruchsvolle Einsätze, damit auch künftig praktisch alle ""Zivis"" alle Diensttage im öffentlichen Interesse leisten. Die Vorlage stellt damit sicher, dass weiterhin alle ""Zivis"" alle Diensttage leisten, das kann nicht genug betont werden. Damit wird eben die Wehrgerechtigkeit gestärkt. Es gibt keinen Grund, mit der Revision zuzuwarten. Die Studiengruppe Dienstpflichtsystem hat einen anderen, einen langfristigen Horizont. Wir haben aber jetzt Handlungsbedarf. Auch die Weiterentwicklung der Armee müssen wir nicht abwarten, denn die Anpassungen, die sich daraus für den Zivildienst ergeben, haben wir bereits in die Revision des Militärgesetzes integriert. Der Zivildienst ist grundsätzlich gut unterwegs, es geht um Verbesserungen.
Ich bin heute von der Sinnhaftigkeit und auch der Wehrgerechtigkeit überzeugt, und ich bitte Sie deshalb, auf die Revisionsvorlage einzutreten und in der Detailberatung dann dem Bundesrat zu folgen. 
",N,20150505,4918,VPBR-M,99.0,2015-05-05T15:55:15,2015-05-05T16:07:16,VPBR-M,DE
539,186137,34820,3867,"Herr Bundesrat, Sie haben gesagt, dass sich die Zivildienstleistenden auch auf die neue Agrarpolitik auszurichten hätten. Ich denke da an Biodiversitäts- und Ökoeinsätze. Meine Frage an Sie: Können die Zivildienstleistenden auch für die traditionelle Agrarpolitik eingesetzt werden, zum Beispiel für die Produktion von Alpkäse? Gegenwärtig fehlt es überall an Alppersonal.
",N,20150505,4918,Mit-M,1.0,2015-05-05T16:07:16,2015-05-05T16:07:49,Mit-M,DE
540,186138,34820,508,"Herr Nationalrat Aebi, Sie wissen, dass die Zivildienstleistenden ein Pflichtenheft erhalten. Dieses Pflichtenheft wird mit der Einsatzstelle verhandelt. Die Zivildienstleistenden werden entsprechend ihren Möglichkeiten eingesetzt. Die Landschaftsqualitätsbeiträge der ""Zivis"" sind nur ein Beispiel, das ist nicht abschliessend. Mit anderen Worten: Sie können auch im Alpbereich eingesetzt werden, wenn Pflichtenheft und Einsatzstelle auf diese Art zusammengeführt werden können. 
",N,20150505,4918,VPBR-M,99.0,2015-05-05T16:07:49,2015-05-05T16:08:32,VPBR-M,DE
541,186139,34820,151,"Sie verkaufen uns diese Revision unter anderem damit, dass die ""Zivis"" vermehrt ausgebildet und betreut werden sollen. Welche Auswirkungen hat diese Revision bezüglich des Personalbedarfs? Steigt dieser weiter an? Ist das eine Vorlage, aufgrund welcher es mehr Beamte geben wird? Oder wie schätzen Sie den Personalbedarf ein, wenn Ausbildung und Betreuung verstärkt werden sollen?
",N,20150505,4918,Mit-M,1.0,2015-05-05T16:08:32,2015-05-05T16:09:09,Mit-M,DE
542,186140,34820,508,"Herr Nationalrat Miesch, wir erfüllen die Motion Müller Walter, wir bilden die ""Zivis"" für Einsätze im Pflegebereich, für Einsätze im Betreuungsbereich besser aus. Die Aufwendungen für den Vollzug des geänderten Zivildienstgesetzes sind bundesseitig nicht höher, als sie herkömmlicherweise sind.
",N,20150505,4918,VPBR-M,99.0,2015-05-05T16:09:09,2015-05-05T16:09:36,VPBR-M,DE
543,186141,34820,3924,"Je tiens à vous rappeler brièvement pourquoi la commission vous propose, in fine, d'adopter ce projet - elle-même l'a fait, par 17 voix contre 5, au vote sur l'ensemble. C'est parce que donner la possibilité à des jeunes, qui ne peuvent concilier le service militaire avec leur conscience, d'effectuer le service civil ne met pas en danger la défense nationale, au contraire! Ces personnes peuvent ainsi effectuer des tâches utiles, manifester leur attachement à leur pays et contribuer de la sorte à renforcer la cohésion nationale. Cela est très important.
C'est pourquoi, au nom de la majorité, je vous invite à entrer en matière sur ce projet.
",N,20150505,4918,Mit-M,1.0,2015-05-05T16:09:36,2015-05-05T16:10:38,*,FR
544,186142,34820,1137,"Ich glaube, ich kann im Namen der Mehrheit der Kommission feststellen, dass wir erstens die Bundesverfassung respektieren und dass wir zweitens den Dienstleistenden, unabhängig davon, ob sie in der Armee oder im Zivildienst ihre Staatspflicht erfüllen, herzlich danken. Sie sind einerseits zuständig für unsere Sicherheit, und andererseits leisten sie uns den Dienst im Zivilen. Beides ist für uns verfassungsgemäss, und wir danken den Frauen und Männern, die diesen Dienst leisten. 
",N,20150505,4918,Mit-M,1.0,2015-05-05T16:10:38,2015-05-05T16:11:21,*,DE
519,186117,34819,4071,"Ich habe meinen Ordnungsantrag im Hinblick auf die für morgen vorgesehene Debatte eingereicht.
Die Stromeffizienz-Initiative will sicherstellen, dass im Rahmen der Energiestrategie 2050 der Effizienz der ihr gebührende Stellenwert zukommt. Je nach Ergebnis der Beratungen über die Energiestrategie 2050 in den eidgenössischen Räten kann die Initiative zurückgezogen werden oder eben nicht. Diejenigen, welche nicht grundsätzlich gegen Massnahmen zur Steigerung der Energie- und Stromeffizienz sind, können meines Erachtens erst nach Vorliegen der Energiestrategie 2050 beurteilen, ob die Initiative dem Volk mit der Empfehlung auf Ablehnung oder auf Annahme unterbreitet werden soll.
Damit macht es keinen Sinn, die Initiative in dieser Sondersession inhaltlich zu beraten und eine Abstimmungsempfehlung zu beschliessen. Dem trägt der Antrag der Minderheit Müller-Altermatt, unterstützt durch einen gleichlautenden Antrag Noser, Rechnung; sie wollen die Behandlungsfrist um ein Jahr, also bis zum 15. November 2016, verlängern. Zu diesem Zeitpunkt werden wir wissen, was in der Energiestrategie 2050 stehen wird, und können dann eine Empfehlung beschliessen, wenn die Initiative nicht zurückgezogen werden kann oder schon zurückgezogen sein wird.
Mein Antrag erlaubt es also, dass wir uns sachgerecht inhaltlich mit dem wichtigen Thema befassen können, und er leistet darüber hinaus einen Beitrag zur Effizienz - zwar nicht zur Energie- oder Stromeffizienz, aber zur mir ebenfalls wichtigen Sitzungseffizienz in diesem Rat. Danke für Ihre Unterstützung!
",N,20150505,4918,Mit-M,1.0,2015-05-05T16:12:55,2015-05-05T16:15:21,Mit-M,DE
518,186116,34819,1103,"Der Ordnungsantrag ist formell nicht ganz abwegig. Es ist ja immer wieder schön, wenn das Verfahren der Taktik entgegenkommt oder ihr mindestens ein wenig nützlich ist. Grundsätzlich scheint hier die Hemmschwelle für Volksabstimmungen im Bereich Energie schon ziemlich gestiegen zu sein. Es scheint mir deshalb, dass die Taktik dem Formellen vorausgeht. 
Wer weiss, was er will, der kann bereits heute entscheiden. Die FDP-Liberale Fraktion kann das und lehnt deshalb den Ordnungsantrag ab.
",N,20150505,4918,Mit-F,1.0,2015-05-05T16:15:21,2015-05-05T16:16:29,Mit-F,DE
517,186115,34819,1135,"Wenn wir effizient arbeiten wollen, dann behandeln wir jetzt das vorbereitete Geschäft - wir haben es ja alle in den Fraktionen vorbereitet. Wir von der SVP sind bereit, über dieses Geschäft zu beraten. Seien wir doch ehrlich zueinander! Worum geht es Herrn Gasche? Er will das Geschäft verschieben, er will das Geschäft möglichst lange verschieben, weil man das Volk noch möglichst lange nicht über diese Fragen abstimmen lassen will. Das hat natürlich auch etwas mit Taktik zu tun - aber dann stehen Sie wenigstens dazu! Wir wollen das Volk zu diesem Geschäft befragen, und das Volk wird dann schon sagen, was es will. 
",N,20150505,4918,Mit-M,1.0,2015-05-05T16:16:29,2015-05-05T16:17:28,Mit-M,DE
516,186114,34819,4063,"Ich staune schon etwas. Man wirft jetzt hier jenen, die eine Verfahrenskoordination anstreben, taktische Winkelzüge vor. Wir haben uns in der Kommission Filibuster anhören müssen, dass uns ganze Körperhälften eingeschlafen sind. Das war der Fall in den letzten Monaten. Wir haben verschiedenste Scheingefechte vonseiten derer erlebt, die uns jetzt vorwerfen, wir möchten hier irgendwelche Winkelzüge ausleben.
Wir wollen eine Verfahrenskoordination. Das ist alles, was wir wollen. Es macht einfach keinen Sinn, jetzt einen Beschluss zu fassen, ohne dass man die Sachlage vollumfänglich kennt. Es ist so: Wir haben in dieser ganzen Debatte zwei Lager. Wir haben ein konstruktives und ein destruktives Lager. (Unruhe)
Im konstruktiven Lager gibt es zwei Meinungen: Die einen sagen, der Königsweg sei die Energiestrategie, die anderen sagen, der Königsweg sei die Stromeffizienz-Initiative. Bevor wir im konstruktiven Lager nicht wissen, was mit der Energiestrategie geschieht, können wir auch nicht über die Stromeffizienz-Initiative Beschluss fassen. Das ist der einzige und sachlogische Grund, weshalb wir diesen Ordnungsantrag und später auch meine Minderheit unterstützen. 
",N,20150505,4918,Mit-M,1.0,2015-05-05T16:17:28,2015-05-05T16:19:05,Mit-M,DE
514,186112,34819,1138,"Die GLP-Fraktion ist bereit, diese Vorlage zu behandeln. Wir wären schon seit Langem bereit gewesen, diese Vorlage zu behandeln. 
Die Behandlung dieser Volksinitiative ist eigentlich ein bisschen ein Trauerspiel. Bereits in der UREK wurde mehrmals diskutiert: abhandeln, bestimmen, abstimmen? Die SVP ist wenigstens ehrlich: Sie will die Initiative nicht, sie will keinen Gegenvorschlag, sie will keine Energiewende; also möchte sie auch über die Volksinitiative so rasch als möglich abstimmen. Bei den Initianten ist es etwas anders, und die Initianten muss man ernst nehmen. Die Initianten - es hat auch Vertreter der SVP und der FDP dabei - haben mehrmals signalisiert, dass man, wenn der indirekte Gegenvorschlag, eigentlich die Energiestrategie 2050, gewisse Punkte bezüglich Energieeffizienz umsetze, einen Rückzug der Volksinitiative sehr wohl ins Auge fasse. Was macht das Parlament im Normalfall, wenn die Initianten zu einem Rückzug bereit sind? Man ist bereit, eine Verfahrenskoordination einzugehen. Was macht die FDP-Fraktion in diesem Trauerspiel? Einmal will sie über diese Initiative abstimmen, sie bringt Anträge auf sofortiges Abstimmen in die UREK. Beim Rückkommen sagt sie, sie habe gemerkt, dass es eigentlich doch cleverer wäre, man würde die Beratung noch einmal vertagen. 
Schon immer wohnten zwei Seelen in meiner Brust. Eigentlich bin ich der Meinung, dass wir heute abstimmen sollten, um die FDP endlich auflaufen zu lassen. Ihr Flaggschiff in Zürich - es ist Herr Ruedi Noser - ist einer der Hauptinitianten dieser Initiative, er steht dazu, er möchte einen Gegenvorschlag, er möchte eine Lösung. Und sein Konterpart -  Herr Wasserfallen, der Sprecher der FDP, der die Energiewende nicht will - will das Gegenteil, er will die Initiative ablehnen. Am besten wäre eine solche Abstimmung noch im Jahr 2015. Die haben wir bis jetzt verhindert. Da hätten sich die FDPler mal bekämpfen und zeigen können, wie ökologisch ihr Profil ist: null Komma null!
Die Grünliberalen werden heute aber nicht im Interesse der Parteipolitik, das wir in diesem Wahljahr haben, sondern im Interesse der Sache, der Verfahrenskoordination, stimmen. Ich persönlich werde also contre coeur diesen Ordnungsantrag unterstützen, weil er sachlich richtig ist. Eigentlich wäre es mir lieber, wir würden die Initiative politisch diskutieren und damit die Unglaubwürdigkeit der Umwelt- und Energiepolitik der FDP öffentlich aufzeigen.
",N,20150505,4918,Mit-M,1.0,2015-05-05T16:19:13,2015-05-05T16:21:40,Mit-M,DE
492,186090,34817,4128,"Ich spreche für beide Minderheitsanträge van Singer, weil sie die gleiche Thematik betreffen.
Der erste Antrag der Minderheit van Singer betrifft Artikel 3a Absatz 1 Buchstabe e. Sie beantragt, dem Entwurf des Bundesrates zu folgen, dass Zivildienst auch geleistet werden kann, um, wie in Buchstabe e hinzugefügt wird, ""die schulische Bildung und Erziehung zu unterstützen"". Es geht also darum, dass Zivildienstleistende in Schulen Unterstützung leisten können.
Der zweite Antrag der Minderheit van Singer betrifft Artikel 4 Absatz 1 Buchstabe bbis. Auch hier beantragt sie, wie es der Bundesrat vorgeschlagen hat, dass der Tätigkeitsbereich auch das Schulwesen, Vorschulstufe bis Sekundarstufe II, umfasst. 
Diese beiden Zusätze möchten wir gerne so belassen, wie es der Bundesrat vorgeschlagen hat. Bereits heute können in einigen Kantonen Zivildienstleistende in die Schulen gehen. Ich habe extra mal in Zürich so einen Unterricht besucht. Dort war ein ""Zivi"" zur Unterstützung im Turnunterricht dabei. Das war wirklich eine Win-win-Situation, für die Lehrerin, aber auch für die Kinder und den ""Zivi"" selber. Er hat eine Unterstützung im Sportunterricht geboten, und die Kinder hatten einen weiteren Ansprechpartner. Wir haben aber auch eine Win-win-Situation genau bezüglich der Diskussion, dass in der Grundschule ja sehr viele weibliche Lehrpersonen unterrichten. Da beklagen wir ja immer, dass es gar keine männlichen Lehrpersonen mehr hat. Da könnten wir mit diesem zusätzlichen Einsatzgebiet ein bisschen ein ausgewogeneres Verhältnis schaffen, indem eben auch ""Zivis"", die ja immer Männer sind, in den Grundschulen als männliche Pendants walten könnten. 
Wir finden, dass die Schule ein sehr sinnvolles Einsatzgebiet ist, und ich möchte Sie deshalb bitten, den Anträgen der beiden Minderheiten van Singer zuzustimmen und damit auch der bundesrätlichen Vorlage zu folgen.
",N,20150505,4918,Mit-F,1.0,2015-05-05T16:24:20,2015-05-05T16:26:46,Mit-F,DE
491,186089,34817,4120,"Soll der Zivildienst jetzt neu auch die schulische Bildung und Erziehung unterstützen? Der Bundesrat schlägt es uns vor, und die zuständigen Organisationen setzten sich vehement dafür ein, dass dies möglich wird.
Die CVP/EVP-Fraktion wird grossmehrheitlich den Anträgen der Kommissionsmehrheit zustimmen und Artikel 3a Absatz 1 Buchstabe e und Artikel 4 Absatz 1 Buchstabe bbis streichen. Diese Erweiterung der Ziele und Tätigkeitsbereiche für ""Zivis"" ist unnötig, unklar und in der heute präsentierten Form nicht sinnvoll. Das Lehrpersonal an schweizerischen Schulen braucht keine Assistenten, und der Einsatz von Zivildienstleistenden in Schulen kann der Einhaltung von Minimalanforderungen nicht entsprechen. Was machen diese jungen Leute den ganzen Tag in einer Schule oder in einer Schulklasse? Was machen sie, wenn kein Schulbetrieb herrscht? Welche Tätigkeiten sollen sie ausüben?
Was uns von den Befürwortern präsentiert wurde, ist nicht ausreichend, findet man doch niemals ausreichend Tätigkeiten für acht Stunden täglich, und vermischt sie stark mit den Aufgaben, die vom Lehr- und Administrativpersonal übernommen werden müssen. Dieses Personal braucht keine Assistenten, zumal dies auch Ungleichheiten schaffen würde zwischen Schulen, die von ""Zivis"" unterstützt werden, und anderen, welche diese Dienste nicht in Anspruch nehmen können oder wollen. Warum soll ein Lehrer die Korrektur einer Prüfung oder der Schulaufgaben an einen  Assistenten delegieren? Seine Tätigkeit sieht vor, dass er das selber machen muss.
Klar muss sofort betont werden, dass unsere Fraktion nicht gegen die bereits heute möglichen Einsätze zugunsten von Schulen oder Schulklassen mit Kindern mit sozialen oder gesundheitlichen Problemen, also zugunsten von sogenannten integrativen Schulen, ist. Dort ist ein Einsatz eines Zivildienstleistenden sinnvoll; dort hat er etwas sehr Spezifisches zu tun. Im normalen Schulbetrieb ist er nicht nötig. Pausenaufsicht, Mithilfe im Skilager oder die Unterstützung bei Verwaltungstätigkeiten sind keine Tätigkeitsbereiche für Zivildienstleistende. Diese Aktivitäten müssen von der Schule selbst erledigt werden und können eventuell an Pensionierte oder Arbeitslose delegiert werden.
Ich verstehe das Interesse der betroffenen Kreise, es ist legitim, man sieht eine Chance, gratis Unterstützung zu bekommen. Die Lösung liegt aber nicht beim Zivildienst. Teilweise muss die Freiwilligenarbeit gestärkt werden, in anderen Bereichen können die Familien mehr leisten. Wenn es um das Korrigieren und Vorbereiten geht, muss es das Lehrpersonal selber schaffen. Das gilt auch für Skilager und Ausflüge.
Die Mehrheit der CVP/EVP-Fraktion beantragt die Streichung dieser neuen Ziele und Tätigkeitsbereiche. Man will diese Möglichkeit im Gesetz festschreiben, man weiss aber noch nicht, wie es dann konkret zu organisieren ist; das wurde während der Kommissionsdebatten sehr klar dargestellt.
Il gruppo PPD/PEV si oppone chiaramente all'impiego di civilisti nelle scuole. Quanto proposto dal Consiglio federale non è chiaro, sensato e utile. Cosa dovrebbero fare tutto il giorno questi giovani nelle scuole? Fungere da assistenti dei docenti? Correggere esperimenti o compiti? Non è corretto e non è sensato! Queste persone non avranno sufficiente lavoro da svolgere o si occuperanno di attività che possono e devono essere svolte dai docenti e dalle direzioni medesime. Penso alla sorveglianza nelle pause e a mezzogiorno, oggi spesso garantita da pensionati, o ad attività burocratiche, per le quali si possono impiegare persone disoccupate. I civilisti non vanno impiegati nelle scuole, poiché il funzionamento delle strutture deve essere garantito dai docenti e dal personale amministrativo. Capisco l'interesse da parte loro, ma il servizio civile non è pensato per questo. L'allargamento degli scopi e dei campi d'attività del servizio civile va respinto. Il dipartimento medesimo non sa cosa far fare ai giovani che andranno nelle scuole e tutto quanto presentato non soddisfa i criteri minimi.
",N,20150505,4918,Mit-M,1.0,2015-05-05T16:26:46,2015-05-05T16:31:35,Mit-M,DE
